This is the real secret of life — to be completely engaged with what you are doing in the here and now. And instead of calling it work, realize it is play.|Alan Watts
To study the Buddha Way is to study the self. To study the self is to forget the self. To forget the self is to be actualized by myriad things.|Eihei Dogen
When you do something, you should burn yourself up completely, like a good bonfire, leaving no trace of yourself.|Shunryu Suzuki
We are here to awaken from our illusion of separateness.|Thích Nhat Hanh
Not thinking about anything is Zen. Once you know this, walking, sitting, or lying down, everything you do is Zen.|Bodhidharma
The whole moon and the entire sky are reflected in one dewdrop on the grass.|Eihei Dogen
Walk as if you are kissing the Earth with your feet.|Thích Nhat Hanh
Whatever has the nature of arising has the nature of ceasing.|The Buddha
